,review_code,place_code,ItemID,UserID,review,Rating,Timestamp
1837,GJ001838,STORE_GJ00033,건대사시미,12a9k9h,넘 친절쓰하세요ㅎㅎ 라면사리랑 콘구이??도 서비스로 주셨어요ㅠㅠ 매운탕 단독으로 되니까 얼큰한거 땡기면 가보세용 맛나요,5,2020.07.23.
1838,GJ001839,STORE_GJ00033,건대사시미,edhksv,"구성 깔끔하고 회도 맛있는데, 대학근처라 그런가 가격이 저어어어엉말 싼곳 회 말고 너무 아무것도 안나오는집도, 너무 거하게 나오는 집도 싫다면, 요기 추천합니다",4,2020.06.26.
1839,GJ001840,STORE_GJ00033,건대사시미,g7ofub,맛 괜찮구요 사장님 친절해요,4,2019.10.13.
1840,GJ001841,STORE_GJ00033,건대사시미,uh283f,조금 좁지만 나쁘진 않음,3,2018.10.29.
1841,GJ001842,STORE_GJ00033,건대사시미,111ilfp,NaN,4,2017.04.15.
1842,GJ001843,STORE_GJ00033,건대사시미,10e29jk,찔끔찔끔...  생와사비 쓰는 것에는 인정,3,2016.06.23.
1843,GJ001844,STORE_GJ00034,마초쉐프 건대점,mg8lg7,물병 더러워요 위생이 걱정됨.. 맛은 그냥 그래요,2,2021.07.23.
1844,GJ001845,STORE_GJ00034,마초쉐프 건대점,qh15g9,4/5 월 리뷰알바 확인 암행어사요~,1,2021.04.09.
1845,GJ001846,STORE_GJ00034,마초쉐프 건대점,13ko4kt,처음 방문했는데 스테이크 너무 맛있고 파스타도 맛있었어요! 직원분들도 친절하셔서 기분 좋게 먹고 나왔어요 다음에 또 방문할게요 ;),5,2021.02.07.
1846,GJ001847,STORE_GJ00034,마초쉐프 건대점,11o0krr,평점조정들어가야지 이건,1,2021.01.30.
1847,GJ001848,STORE_GJ00034,마초쉐프 건대점,l8bh44,알바 쓰지 마세요,1,2021.01.21.
1848,GJ001849,STORE_GJ00034,마초쉐프 건대점,1fb4oh3,음식도 빠르게 나오고 위치도 좋고 맛도 맛있어여!! 가족들이랑 식사 하기 좋아요!!,5,2021.01.10.
1849,GJ001850,STORE_GJ00034,마초쉐프 건대점,1dkaeqd,위생적이고 깔끔한 맛집! 근처 올때마다 생각나네요!! 맛있어요,5,2021.01.10.
1850,GJ001851,STORE_GJ00034,마초쉐프 건대점,1fbp9sl,재방문하고 싶을정도로 가게 분위기도 좋았고 음식들도 너무 맛있게 먹었어요!,5,2021.01.10.
1851,GJ001852,STORE_GJ00034,마초쉐프 건대점,1fcjlbp,"여자친구랑 같이갔는데, 음식맛이나 인테리어도 좋고, 여자친구가 엄청 만족해 하네요!",5,2021.01.10.
1852,GJ001853,STORE_GJ00034,마초쉐프 건대점,1fbp8rf,데이트하기에 좋았어요!! 볼거리도 많고 음식도 가성비 짱짱 !!,5,2021.01.09.
1853,GJ001854,STORE_GJ00034,마초쉐프 건대점,1fb4kok,맛있어요!! 여자친구랑 같이 갔는데 여자친구도 맛있다그러네요,5,2021.01.08.
1854,GJ001855,STORE_GJ00034,마초쉐프 건대점,7ukolh,NaN,1,2020.11.30.
1855,GJ001856,STORE_GJ00034,마초쉐프 건대점,s2vsi0,맛없고 비싸기만 함 인스타감성 원툴,1,2020.11.06.
1856,GJ001857,STORE_GJ00034,마초쉐프 건대점,19sokrs,정말 무딘편인데 서비스적부분에서 먹기 전부터 기분상하고 불편한간 처음이었어요,1,2020.11.01.
1857,GJ001858,STORE_GJ00034,마초쉐프 건대점,v1k8k0,가격은 조금 센편인데 그래도 변하지않는 맛이랑 적당한 양이라서.약속잡고 마땅히 먹을거안정하고 만났을때 가기 좋은곳같아요. 맛에 호불호가없을것같은 삽겹스테이크가 제일 추천입니다~!기본파스타는 전부 평균은 하는것같아요! 다만주방가까이 앉으면 주방연기때문에 기침이 나와서..ㅎㅎ..주방 먼 자리추천합니다,4,2020.09.26.
1858,GJ001859,STORE_GJ00034,마초쉐프 건대점,18c5j7t,가격도 괜찮고 맛있었어요~,5,2020.08.16.
1859,GJ001860,STORE_GJ00034,마초쉐프 건대점,18spoc9,여기 직원들 마스크 안씀ㅜㅜ 단 한명도.... 주방도 마스크 안써요 코로나 걸리기 딱인듯 구웨엑,1,2020.06.23.
1860,GJ001861,STORE_GJ00034,마초쉐프 건대점,192ca2a,고기는 맛있는데 뼈가 좀 많구 파스타는 그럭저럭ㅜ,3,2020.06.09.
1861,GJ001862,STORE_GJ00034,마초쉐프 건대점,16usm7k,맛도 그냥저냥 공산품보다 못하고 가격도 비싼편,2,2020.03.13.
1862,GJ001863,STORE_GJ00034,마초쉐프 건대점,cnc57d,"장소가 넓어 웨이팅이 없어 좋았고, 양이 많아 배불리 먹었습니다! 삼겹살 스테이크의 불쇼(고기에 불 붙이는거)를 보는것과 맛은 좋았습니다만 오돌뼈가 좀 많이 있어 오돌뼈를 좋아하지 않는 분들께선 드실때 주의해주시구요. 피자와 리조또는 약간 단맛이 있는데 그리 나쁘진 않았습니다.",4,2020.02.23.
1863,GJ001864,STORE_GJ00034,마초쉐프 건대점,1371vt3,암행어사 출두요! 별점주작함,1,2020.02.14.
1864,GJ001865,STORE_GJ00034,마초쉐프 건대점,15dgr7m,고기 최고였다 스파게티는 그럭저럭,4,2020.01.12.
1865,GJ001866,STORE_GJ00034,마초쉐프 건대점,rhbdc8,별로였습니다.,2,2019.12.03.
1866,GJ001867,STORE_GJ00034,마초쉐프 건대점,kk0pe8,NaN,3,2019.11.24.
1867,GJ001868,STORE_GJ00034,마초쉐프 건대점,8qcisv,일단 알바들 풀어놓은 곳은 평점 조정 들어가줍시다. 정말 부정직한 마인드.,1,2019.08.13.
1868,GJ001869,STORE_GJ00034,마초쉐프 건대점,ve8544,NaN,4,2019.06.06.
1869,GJ001870,STORE_GJ00034,마초쉐프 건대점,lbl4e3,마초삼겹스테이크 고구마피자 정말 최고였어요 처음가보는 곳인데 블로그를 보고 메뉴를 골라갔더니 와우  메뉴선택이 너무좋았네요 꼭 드셔보세요  가격대가 학생들 끼니로는 싼편은 아니니  데이트할때 가면 좋을것 같아요! 분위기도 좋아요!  *두번째 갔네요 같은메뉴 먹었어요 ㅎㅎ 사진추가했습니다,5,2019.06.04.
1870,GJ001871,STORE_GJ00034,마초쉐프 건대점,bnohpd,그저그럼,2,2019.01.25.
1871,GJ001872,STORE_GJ00034,마초쉐프 건대점,lp4dl5,메뉴 잘 고르면 맛있음요,4,2018.12.03.
1872,GJ001873,STORE_GJ00034,마초쉐프 건대점,flgo1d,여기 별점러들 4월 5월 반짝 알바쓴듯 문맥도비슷하고 '마초쉐프'라고 몇번이고 반복해서 쓰는게 딱 알바들 ㅋㅋㅋ,3,2018.11.22.
1873,GJ001874,STORE_GJ00034,마초쉐프 건대점,100q04c,걍 ,2,2018.09.05.
1874,GJ001875,STORE_GJ00034,마초쉐프 건대점,bf9fru,무난한 맛집입니다,3,2018.01.08.
1875,GJ001876,STORE_GJ00035,안다즈커피,1iigbsl,사진찍으러가는곳,2,2021.07.31.
1876,GJ001877,STORE_GJ00035,안다즈커피,11prphp,"모두 다 아름다웠었다..맛도 멋도 좋았다..  머리카락 하나정도는 그냥 넘어가려고 했는데, 마지막 거의 다 마셨을때 잔의 밑바닥에서 또 한가닥 나옴..  화장실 변기 앉는곳에 오줌 튄것좀 잘 치워주십시요..",1,2021.07.30.
1877,GJ001878,STORE_GJ00035,안다즈커피,nd6bfq,여기 무슨 샌드위치가 존맛이에요 이름은 모르지만 옥수수 들어가있어요! 커피도 맛있어요 다만 단점은 1층에 와파가 잘 안 터져요ㅠㅠ,5,2021.07.05.
1878,GJ001879,STORE_GJ00035,안다즈커피,srf1j9,헐… 밀크티 멈춰!!!! 추천 메뉴 멈춰,4,2021.06.19.
1879,GJ001880,STORE_GJ00035,안다즈커피,7mkjcq,살려주세요....,1,2021.05.25.
1880,GJ001881,STORE_GJ00035,안다즈커피,1fi3e72,맛 딸기 크로와상 라즈베리 스콘 빵맛있음  커피는 소소 그치만 식기가 이뻐서 좋음  분위기도좋다 창가에 햇볕이 드는곳이 있어서 굿굿  서비스 무,3,2021.04.06.
1881,GJ001882,STORE_GJ00035,안다즈커피,betcln,NaN,2,2021.04.03.
1882,GJ001883,STORE_GJ00035,안다즈커피,7otprn,맛없고 비싸요 특히 밀크티 핵 맛없어요,1,2021.03.27.
1883,GJ001884,STORE_GJ00035,안다즈커피,lfq7qu,NaN,5,2021.03.20.
1884,GJ001885,STORE_GJ00035,안다즈커피,vqsnrv,분위기도 좋고 디저트 종류 다양해요 그런데 가격대비 음료 맛이나 양이 아쉽네요,3,2021.02.13.
1885,GJ001886,STORE_GJ00035,안다즈커피,mscu3b,넓고 디저트류도 맛있어요! 전체적으로 포근한 갈색이라 쉬어가기 좋은 카페에요,5,2020.12.10.
1886,GJ001887,STORE_GJ00035,안다즈커피,1688vej,카페도 예쁘고 분위기도 좋고 특히 좌석에 따뜻한 열 들어오는거 너무 좋음 ㅠㅠㅠㅠ ㅠㅠㅠㅠㅠㅠ,5,2020.11.25.
1887,GJ001888,STORE_GJ00035,안다즈커피,mv2qa9,"분위기 좋고 디저트는 맛있으나 음료는 별로예요. 로투스라떼, 아인슈페너 먹었는데 특별할 거 없는 맛",4,2020.11.20.
1888,GJ001889,STORE_GJ00035,안다즈커피,1au8ji8,분위기 좋고 맛도 좋고,5,2020.09.27.
1889,GJ001890,STORE_GJ00035,안다즈커피,tc168m,"야외카페찾다가우연히들어갔는데,커피맛도분위기도스콘맛도최고에요.바깥자리라모기와의전쟁이었지만가을분위기최고입니다.  ",5,2020.09.23.
1890,GJ001891,STORE_GJ00035,안다즈커피,o04d4m,NaN,4,2020.07.18.
1891,GJ001892,STORE_GJ00035,안다즈커피,nbrs0l,좋아요 ㅎㅎ,5,2020.07.16.
1892,GJ001893,STORE_GJ00035,안다즈커피,bjpgo8,좋아요,3,2020.07.13.
1893,GJ001894,STORE_GJ00035,안다즈커피,165dq0c,"반려동물 출입 가능하고, 커피 맛있고 디저트도 괜찮고 분위기도 좋아서 자주 가는 카페에요! 직원분 친절하신거는 잘 모르겠고,,, 음료 양은 확실히 적어요,,",5,2020.06.07.
1894,GJ001895,STORE_GJ00035,안다즈커피,17gah5u,조용하고 분위기 좋아요,5,2020.04.25.
1895,GJ001896,STORE_GJ00035,안다즈커피,ljqq1v,"장소, 분위기, 커피 맛 다 좋습니다.  다만 알바생인지 모르겠지만 너무 불친절 합니다.  무표정한 얼굴로 퉁명스러운 말투, 그 어떤 서비스 정신도 찾아보기 힘든 모습이었습니다.  동그란 안경 쓰신 직원분, 저희도 제 돈 내고 이용하는 고객입니다. 많은거 바라지도 않습니다. 퉁명스러운 말투, 딱딱한 태도, 질문에 한숨부터 내쉬시고.  사장님(?)은 반대로 ...",2,2020.04.23.
1896,GJ001897,STORE_GJ00035,안다즈커피,15euhks,"음료나 커피, 빵 기대하고가면 비추천합니다.",2,2020.01.12.
1897,GJ001898,STORE_GJ00035,안다즈커피,7kl890,다른곳에 비해 맛있는 빵이나 음료도 없고 보이는 멋만 잔뜩 부리는 느낌. 비싼 가격에 비해 만족도가 낮아요.,2,2019.12.18.
1898,GJ001899,STORE_GJ00035,안다즈커피,refjse,최근 다시 와보니 더 좋아졌습니다. 커피 종류도 다양해지고 디저트도 맛있습니다. ,5,2019.07.09.
1899,GJ001900,STORE_GJ00035,안다즈커피,g0kf83,분위기 좋아요. 커피가 좀 비싼 감은 있지만 가볼만 합니다. ,4,2019.07.06.
1900,GJ001901,STORE_GJ00035,안다즈커피,h50u7o,예쁘고 분위기 좋은 곳. 불친절한 서비스. 스태프들의 태도에 기분나빴음,3,2019.04.28.
1901,GJ001902,STORE_GJ00035,안다즈커피,no9p12,여기 커피두 커피인데 케이크 맛집임... 선곡도 아주 괜찮아요!,5,2019.04.11.
1902,GJ001903,STORE_GJ00035,안다즈커피,10k2j6v,Coffee & Cake,4,2019.03.14.
1903,GJ001904,STORE_GJ00035,안다즈커피,r1lh29,분위기 좋아여  음료 양이 너무 적어요,4,2018.10.17.
1904,GJ001905,STORE_GJ00036,스시텐 강변점,liuhkf,아 우리 집 앞으로 옮겨놓고싶다,5,2021.08.15.
1905,GJ001906,STORE_GJ00036,스시텐 강변점,n7q2hv,초밥은 무조건,5,2021.07.16.
1906,GJ001907,STORE_GJ00036,스시텐 강변점,147a5vk,? 잘있는데;; 괜찮음,5,2021.07.03.
1907,GJ001908,STORE_GJ00036,스시텐 강변점,13kfnpv,NaN,4,2021.06.11.
1908,GJ001909,STORE_GJ00036,스시텐 강변점,1i4esdk,없어짐,2,2021.04.02.
1909,GJ001910,STORE_GJ00036,스시텐 강변점,f640gq,초밥도 너무 싱싱해보이고 엄청 맛있어요!,5,2021.03.05.
1910,GJ001911,STORE_GJ00036,스시텐 강변점,qpbsuu,이가격에 이 맛 합리적이구 최고입니다!!,5,2021.02.21.
1911,GJ001912,STORE_GJ00036,스시텐 강변점,fukhkf,동네 최고의 맛집 가성비 짱,5,2021.02.18.
1912,GJ001913,STORE_GJ00036,스시텐 강변점,15p5qfs,초밥도 맛있는데 후식으로 주는 양갱도 맛있음 강변 명물 스시텐 ,5,2021.01.31.
1913,GJ001914,STORE_GJ00036,스시텐 강변점,1fqro1o,와 이건 ㅋㅋ,5,2021.01.26.
1914,GJ001915,STORE_GJ00036,스시텐 강변점,u1bm49,런치 양 장난아닙니다... 우동도 크게나오고 모밀도 추가로 주시고 양갱도 나오고... 저 많이먹는편인데 배터지겠어요 담에도 꼭 다시오려고합니다,5,2021.01.09.
1915,GJ001916,STORE_GJ00036,스시텐 강변점,11p77m0,무난하게 맛있게 먹는 곳,5,2020.12.08.
1916,GJ001917,STORE_GJ00036,스시텐 강변점,o9psss,jmt,5,2020.11.29.
1917,GJ001918,STORE_GJ00036,스시텐 강변점,kb6cvj,런치세트 맛있게 먹고 갑니다~^^ 3시에 갔는데도 웨이팅이 있어서 놀랬습니다 초밥 우동 소바 양갱 모두 맛있었구요 주차타워 있어서 주차도 편리했습니다,5,2020.11.21.
1918,GJ001919,STORE_GJ00036,스시텐 강변점,14c550t,완전완전 맛있어요!!!!! 다른 집보다 회(?)부분이 엄청 커요!!!,5,2020.11.19.
1919,GJ001920,STORE_GJ00036,스시텐 강변점,164g69a,가격대비 정말 맛있어요! 일하시는 분들도 다들 친절하시고 기분 좋게 먹고 갑니다! 감사합니다,5,2020.10.24.
1920,GJ001921,STORE_GJ00036,스시텐 강변점,15c5lif,"가격 대비 구성이 매우 알차고, 메인메뉴 뿐 아니라 함께 나오는 음식들 모두 맛있습니다. ",5,2020.09.07.
1921,GJ001922,STORE_GJ00036,스시텐 강변점,v9f6ae,런치세트 맛있어요 ㅎ 지인들 놀러올때마다 데리고 가요,5,2020.08.12.
1922,GJ001923,STORE_GJ00036,스시텐 강변점,gn9tbc,이 가격대라고 믿을 수 없는 맛이였습니다. 한국에서 먹은것중에서 최고였네요,5,2020.07.18.
1923,GJ001924,STORE_GJ00036,스시텐 강변점,vfpcec,NaN,1,2020.07.18.
1924,GJ001925,STORE_GJ00036,스시텐 강변점,fi95fk,☆점수기준표☆ 별5개-일부러라도 간다 / 4개-맛있다! 자주 갈만하다 3개- 적당히 생각날때 한번씩간다 / 2개- 2번방문은 그닥? 1개- 이곳을 선택한 과거의 내가 밉다ㅠ  가성비 괜찮은 맛집    ,4,2020.07.10.
1925,GJ001926,STORE_GJ00036,스시텐 강변점,thuc6c,NaN,5,2020.06.04.
1926,GJ001927,STORE_GJ00036,스시텐 강변점,15j2u53,최고에요,5,2020.05.09.
1927,GJ001928,STORE_GJ00036,스시텐 강변점,13oigph,초밥 퀄리티는 보통보다 나은 정도인데.가격은 너무 비쌈 가성비 별로 안좋음,2,2020.04.24.
1928,GJ001929,STORE_GJ00036,스시텐 강변점,12q1ml2,NaN,1,2020.03.17.
1929,GJ001930,STORE_GJ00036,스시텐 강변점,smaii6,스시 퀄이 막 좋지는 않네요.. 스시가 길긴한데 너무 얇네요.. 우동은.. 면이 그냥 젓가락질에 다 잘라지고.. 예전엔 맛있게먹는거같은데 실망하고 갑니다ㅠ 샐러드에 드레싱은 맛있었어요~,1,2019.11.19.
1930,GJ001931,STORE_GJ00036,스시텐 강변점,flldla,가성비 정말 좋은 스시집 직원도 친절하고 맛도 좋음 줄이 길 수 있으니 일찍 가야함,5,2019.06.09.
1931,GJ001932,STORE_GJ00036,스시텐 강변점,va9c77,2호점 쉐르빌도 좋아요!!(주차가 편해요) 친절하시고 맛있네요^^,5,2019.05.09.
1932,GJ001933,STORE_GJ00036,스시텐 강변점,f3tg6v,뭐 한번 가봤어요 초밥 코스식이고 가격은 2만원이라... 동네치곤 좀 비싼느낌,4,2019.03.02.
1933,GJ001934,STORE_GJ00036,스시텐 강변점,100i22n,연어초밥 ☆☆☆☆☆ 특초밥 ☆☆☆☆ 모듬초밥 ☆☆☆  가끔 기복있지만 그래도 항상 내 최애 연어초밥집. ,4,2019.01.07.
1934,GJ001935,STORE_GJ00036,스시텐 강변점,f4eosi,so so & not bad,3,2018.09.09.
1935,GJ001936,STORE_GJ00036,스시텐 강변점,loqgd1,서비스로 우동과 메밀국수가 나와요~,4,2018.09.03.
1936,GJ001937,STORE_GJ00036,스시텐 강변점,fp8i0f,NaN,4,2018.03.18.
1937,GJ001938,STORE_GJ00036,스시텐 강변점,lsfcna,배부르게 먹고싶다면... 탄수화물 가득이지만 가성비는 괜찮은듯.,3,2018.03.10.
1938,GJ001939,STORE_GJ00036,스시텐 강변점,dtk6f3,NaN,3,2018.01.30.
1939,GJ001940,STORE_GJ00036,스시텐 강변점,ei8ep2,NaN,5,2017.11.12.
1940,GJ001941,STORE_GJ00036,스시텐 강변점,bmhjb6,"3명이 배부르게 사시미. 모듬초밥. 나가사끼짬뽕. 사케 2병 먹고 75,000원",4,2016.12.19.
1941,GJ001942,STORE_GJ00036,스시텐 강변점,lg0i2q,저렴한 가격에 일품인 스시맛!! 일본에서 먹던 그 스시맛이라서 너무 좋다 자주 가고싶은곳~,5,2016.11.03.
1942,GJ001943,STORE_GJ00036,스시텐 강변점,b9cr71,"가겅비는 좋운데 , 포장시 기다리는 시간이 너무 길어요. 그리고 이제는 밖에서 기다리기에 추워요......",5,2016.10.30.
1943,GJ001944,STORE_GJ00036,스시텐 강변점,beq1cv,건대 호야붐으로 만들어진 초밥밀집 지역이 질려서 온곳  성공적.  서비스 매우 많음  모밀에 냉동 양갱에 우동까지   나가사끼짬뽕 초밥세트에  특 초밥 세트   엄청 맛있다.  점심에도 웨이팅이 존재 하는곳,5,2016.06.26.
1944,GJ001945,STORE_GJ00037,경양카츠 건대점,cqdtkf,안심과 등심 시켰는데 양이 너무 작습니다.소꿉놀이 하는 느낌이네요.리뷰보고 설마 그럴까?해서 갔는데 진짜 그렇더라고요.사장님은 반성해야합니다.,1,2021.07.22.
1945,GJ001946,STORE_GJ00037,경양카츠 건대점,17pjp3q,NaN,5,2021.05.29.
1946,GJ001947,STORE_GJ00037,경양카츠 건대점,1bjf09v,NaN,4,2021.05.21.
1947,GJ001948,STORE_GJ00037,경양카츠 건대점,mfhbq1,너무 맛있게 잘 먹었습니다.,5,2021.03.15.
1948,GJ001949,STORE_GJ00037,경양카츠 건대점,1f0ptlh,"돈카츠를 정말 좋아하는 사람이에요. 친구들이 뭐 먹을지 고민한다면 무조건 돈카츠 먹으로 가자고 할 정도에요. 경양카츠는 다른 카츠가게와 다르게 족발카츠와 보쌈카츠를 파는데, 다른 지점에 비해 건대점의 족발카츠 정말 맛있어요. 질기지 않고 부드러워요. 고기 특유의 잡냄새도 안나서 좋았어요. 건대점을 방문하신다면 ‘족발카츠’ 하나만은 기억하고 가세요.  그리고...",5,2020.12.29.
1949,GJ001950,STORE_GJ00037,경양카츠 건대점,1f02onr,"일단 직원분이 너무친절하시고 돈까스가 너무맛있었습니다! 다른 경양카츠집보다 특히 수육,족발카츠가 정말맛있었습니다:)",5,2020.12.28.
1950,GJ001951,STORE_GJ00037,경양카츠 건대점,1eu18bh,메인 튀김은 바사악하고 안은 촉초옥하고 말그대로 겉바속촉 존맛탱구리  반찬으로 나온 메뉴들은 추가메뉴로 팔아도 될정도로 퀄리티가 너무 좋아요오오~~~ 재방문 의사 100000% 입니다.,5,2020.12.26.
1951,GJ001952,STORE_GJ00037,경양카츠 건대점,1eu0dv8,저번달?인가 친구랑 저녁먹으러 갔는데 직원분들도 너무 친절하시고 맛도 좋고 기분좋게 식사하고 왔네요!! 늦은 리뷰지만 번창하세요ㅎㅎ ,5,2020.12.26.
1952,GJ001953,STORE_GJ00037,경양카츠 건대점,1e9jd85,"카츠를 정말 좋아하고 많은 곳으로 먹으러 다니는데, 주로 건대점 경양카츠를 방문해요. 다른 지점보다 몇 배로 훨씬 맛있고, 가게 내부도 너무 깔끔합니다. 다른 지점에서 먹어본 카츠가 가격에 비해 만족스럽지 못하여 엄청나게 실망한 기억이 있는데, 같은 메뉴를 건대점에서 먹고나서는 돈이 하나도 아깝지 않았습니다!!!!! 사장님도 정말 친절하시고, 가게에 들어갈...",5,2020.12.06.
1953,GJ001954,STORE_GJ00037,경양카츠 건대점,1e28354,꼭 한번쯤은 가봐야지! 했었는데 한번오니까 주기적으로 와야될거같아요ㅠㅠ 수육카츠 먹었는데 생각보다 양도 많고! 고기냄새도 안나구..!!국수도 더 먹고싶다니까 직원분께서 친절하게 더 드린다구 하셔서 배부르게 잘 먹구 왔습니다!!!,5,2020.12.06.
1954,GJ001955,STORE_GJ00037,경양카츠 건대점,1dap8o2,너무맛있어요! 고기 냄새도 안나고 치즈카츠 안에 치즈가 듬뿍 ㅠㅠ 우동도 너무 맛있고 양이 정말 많아요!!! 사진 보니 또 침고이네요 ㅠㅠㅠㅠ,5,2020.11.03.
1955,GJ001956,STORE_GJ00037,경양카츠 건대점,1dangpr,서울 볼일보고 방문해서 먹었는데 치즈카츠 너무 맛있게 먹었습니다. 프렌차이즈라 거기서 거기겠지 했는데 남다르네요 사장님도 친절 하셨구 위생 상태도 좋아서 더 맛있었어요 서울 올라갈일 있으면 다시 방문 하겠습니다. 코로나로 힘든 시기에 잘 이겨 내고 다시 방문 할 그날 까지 잘 버텨주시길!,5,2020.11.03.
1956,GJ001957,STORE_GJ00037,경양카츠 건대점,1dacjql,안심 너무 부드러워요ㅜㅜ 치즈는 하...너무 맛있어요,5,2020.11.03.
1957,GJ001958,STORE_GJ00037,경양카츠 건대점,fot6jc,비싼가격에 값어치 못하는 퀄리티!! ,1,2020.11.01.
1958,GJ001959,STORE_GJ00037,경양카츠 건대점,18apecc,가게 분위기도 넘 예쁘고 먹는 내내 너무 맛있어서 울었어요.. 다른 경양카츠보다 훨신 맛있어요ㅜㅜ ,5,2020.10.26.
1959,GJ001960,STORE_GJ00037,경양카츠 건대점,12r7cvj,맛잇음,4,2020.10.17.
1960,GJ001961,STORE_GJ00037,경양카츠 건대점,1cnkul6,분위기도 좋고 직원분들도  친절하시고 무엇보다 음식이 너무 맛있었습니다!,5,2020.10.12.
1961,GJ001962,STORE_GJ00037,경양카츠 건대점,1ckhljb,치즈랑 보쌈카츠?랑 등심 먹었는데 부들부들 너무 맛있었고 같이주는 반찬들이랑 같이 먹으면 느끼한줄도 모르고 순삭했음. 아재입맛 남편도 맛있다고 다음에 또 오자함. 일부러찾아간건데 맛있는거 먹어서 기분좋음.!!!,5,2020.10.08.
1962,GJ001963,STORE_GJ00037,경양카츠 건대점,1ckh4ml,치즈 족발 안심 떡갈비 먹었는데 너무 맛있고  양도 적당해요. 건물도 넘 이쁘고 친절해요. 또 방문할게요~~,5,2020.10.08.
1963,GJ001964,STORE_GJ00037,경양카츠 건대점,15iuof9,왜 인기 많은지 잘 모르겠는.. 등심 너무 느끼하고 치즈돈까스는 치즈가 너무 적다 ㅠ  고기에서 누린내 남 ㅠㅠ,2,2020.10.06.
1964,GJ001965,STORE_GJ00037,경양카츠 건대점,147vk5q,웨이팅 기다린보람 있는곳ㅠ..입맛까다로운 친구가 인정한곳.. 그럼 말다한 곳..경양가츠먹고 다른 가츠집 못가는 단점이ㅜ리뷰쓰는데 또먹고싶은 그런 곳...,5,2020.08.17.
1965,GJ001966,STORE_GJ00037,경양카츠 건대점,me67k1,0점주고싶은 식당이네요. 아무리 깔끔하게 리모델링하고 음식이 맛있으면 뭐합니까? 알바생이 일을 하기 싫어하는데 들어가지도 못하고 쫓겨나는데 자리가 있어도 치우지도 않고 한참을 기다려도 치울생각을 안하는데.. 치워진 자리도 분명있었는데 밖에서 기다리라는 말만하고.. 기다리라는 말하면서 왜 짜증을 내는지... 진짜 실망스럽고 기분나쁘네요.,1,2020.08.08.
1966,GJ001967,STORE_GJ00037,경양카츠 건대점,mq1lld,직원이 너무 불친절함 빈자리가 있어서 들어갔더니 정리가 덜됐다며 대기하라고 짜증을 냄 기분 나빠서 먹지도 않고 나옴,1,2020.08.08.
1967,GJ001968,STORE_GJ00037,경양카츠 건대점,13tldgc,"음식 비주얼 좋음, 맛은 괜찮음 가격 비쌈, 애기 밥처럼  조금씩 나옴",3,2020.08.01.
1968,GJ001969,STORE_GJ00037,경양카츠 건대점,1aqvq74,집근처라 자주가는 맛집인데 음식도 빨리 나오고 튀김도 바삭하고 너무 맛있어요! 분위기도  ,5,2020.07.30.
1969,GJ001970,STORE_GJ00037,경양카츠 건대점,1aqvq3h,튀김이 너무 바삭하고 맛있어요 !! 직원분들이 너무 친절해요 굿굿,5,2020.07.30.
1970,GJ001971,STORE_GJ00037,경양카츠 건대점,143mv53,"족발, 치즈 둘다 아주 맛있었어요!! 다음에 또 방문할께요^^",5,2020.07.30.
1971,GJ001972,STORE_GJ00037,경양카츠 건대점,17oga4u,맛나요:) 맨날오고싶어요 건대점이 제일 맛있는듯ㅎㅎ.,5,2020.07.30.
1972,GJ001973,STORE_GJ00037,경양카츠 건대점,1aqtvl3,돈까스가 너무 부드러워요 ! 진짜 맛있어요! 또 방문 할께요 대박나세요 !! ,5,2020.07.30.
1973,GJ001974,STORE_GJ00037,경양카츠 건대점,1aqre8l,인생카츠먹고왓네요 안심카츠 너무맛있어요~,5,2020.07.30.
1974,GJ001975,STORE_GJ00037,경양카츠 건대점,1aqra2n,직원분이 너무 친절하시구 맛있게먹고왔습니다,5,2020.07.30.
1975,GJ001976,STORE_GJ00037,경양카츠 건대점,112r0i8,분위기는 좋은데 맛은 그저그래요 ... 반찬으로 나오는 국수가 맛있음,3,2020.07.16.
1976,GJ001977,STORE_GJ00037,경양카츠 건대점,e8ro6t,NaN,2,2020.07.09.
1977,GJ001978,STORE_GJ00037,경양카츠 건대점,13uobd5,아무리 건대가 핫플이어도 강남도 아니고 같은 체인점인 동대문점보다 같은메뉴전부 4천원 더비쌈. 가성비 극혐이라 건대가면 다른데갈듯,1,2020.04.30.
1978,GJ001979,STORE_GJ00038,매화반점 1호점,uettap,NaN,4,2021.08.04.
1979,GJ001980,STORE_GJ00038,매화반점 1호점,eit0t3,가게 안 불쾌한 냄새가 너무 심하고 시끄러워서 정신이 1도 없음 음식도 하나하나 맛없고... 끔찍한 식사였다,1,2021.06.27.
1980,GJ001981,STORE_GJ00038,매화반점 1호점,1etggve,NaN,4,2021.06.15.
1981,GJ001982,STORE_GJ00038,매화반점 1호점,gbt780,술 취했다고 먹지도 않은 맥주 하나 더 계산에 넣고 손님 등처먹는 곳이네요  양꼬치도 주위 다른곳이 맛있다 손님 등처먹는 곳은 망해라,1,2021.05.19.
1982,GJ001983,STORE_GJ00038,매화반점 1호점,edhksv,줄이 너어어어어어어무 긴거 말고는 요리도 싼가격 양꼬치도 맛 무난무난 나쁘지않은집 재방문 여러번했음,4,2021.05.07.
