,review_code,place_code,ItemID,UserID,review,Rating,Timestamp
0,GJ000001,STORE_GJ00001,광고최원석의돼지한판 광장점,ngfsvv,"점심때 갔는데 프런트에 직원도 없고 손님응대도 별로임, 불친절한 느낌 맛은 있어요",3,2021.08.01.
1,GJ000002,STORE_GJ00001,광고최원석의돼지한판 광장점,8ugcmg,삼겹살 먹었는데 넘 맛있었구요. 사장님과 직원분들 모두 넘넘 친절하셔서 좋았어요. 밑반찬도 짱맛!!! 다음에 가족이랑 다시 갈게요!!,5,2021.07.01.
2,GJ000003,STORE_GJ00001,광고최원석의돼지한판 광장점,murh1q,오...존맛탱... 돼지고기에서 이런 맛이 나네요 숙성돼지고기 많이 먹어봤지만 여긴 찐이네용 그리고 된장찌개 존맛탱이에요 두 번 추가해서 먹었어요ㅋㅋㅋㅋㅋ,5,2021.07.01.
3,GJ000004,STORE_GJ00001,광고최원석의돼지한판 광장점,qo13dj,좋아요 여기,5,2021.05.18.
4,GJ000005,STORE_GJ00001,광고최원석의돼지한판 광장점,k5p9pr,맛있고 친절함,5,2021.05.08.
5,GJ000006,STORE_GJ00001,광고최원석의돼지한판 광장점,1742btr,맛있네요 직원분들도 정말 친절하시고,5,2021.03.12.
6,GJ000007,STORE_GJ00001,광고최원석의돼지한판 광장점,bff9o9,"여기가 이 동네 왕이다. 일단 상차림이 미쳤다. 거기다 고기도 진짜 좋다. 직원, 사장님도 친절.. 체인점이라고는 쳐도 진짜 여기가 이 동네 고기 왕이다. ",5,2021.03.11.
7,GJ000008,STORE_GJ00001,광고최원석의돼지한판 광장점,ls9kmq,맛도 고기질도 좋아요~ 두툼한 고깃살!! 배불리 먹고 왔습니다~ 친구들도 만족해하니 제 마음도 뿌듯합니다~ 또 들르겠습니다!!,5,2021.03.11.
8,GJ000009,STORE_GJ00001,광고최원석의돼지한판 광장점,7nr9c2,정말 두꺼운 돼지고기,5,2020.10.11.
9,GJ000010,STORE_GJ00001,광고최원석의돼지한판 광장점,cibcmr,고기도 신선하고 사장님도 종업원분들도 친절하세요 재방문 하고 싶네요,5,2020.08.02.
10,GJ000011,STORE_GJ00001,광고최원석의돼지한판 광장점,doso6i,"여기 사이드부터 고기 너무맛있어오ㅠㅠㅠ 묵사발이랑 감자샐러드도 맛있고 고기 구워주시는데 너무 친절하시고 진짜너무맛있어오ㅠㅠ 집근처였으면 단골 할듯,,,",5,2020.04.05.
11,GJ000012,STORE_GJ00001,광고최원석의돼지한판 광장점,16376pl,직원들이 다 너무 친절하셔서 기분좋게 식사하고갔어요오!!!  꼭한번 다들 먹어보세여~~!! 맛도 최고입니다 ㅎㅎ,5,2020.02.08.
12,GJ000013,STORE_GJ00001,광고최원석의돼지한판 광장점,10gpenq,NaN,5,2019.12.30.
13,GJ000014,STORE_GJ00001,광고최원석의돼지한판 광장점,toj5ba,삼겹살이랑 삼겹살볶음밥이랑 쭈꾸미만두 먹었어요 만두는 그냥그냥.. 고기 싸먹을 양념이랑 재료가 엄청 많고 너무너무 맛있음 ㅠ 직원도 친절하고 일 너무 잘하심 고기도 다 구워주세요 된찌도 존맛탱 강추 단골할거에요,5,2019.12.09.
14,GJ000015,STORE_GJ00001,광고최원석의돼지한판 광장점,c8fo0s,정상적인 식당이 아님.,1,2019.09.13.
15,GJ000016,STORE_GJ00001,광고최원석의돼지한판 광장점,gcark3,고기도 좋고 가격도 괜찮아요♡,5,2019.06.16.
16,GJ000017,STORE_GJ00002,광고예담밥상,1e76028,가족이랑 오기에딱좋음 금액좀있어도 아깝지않은곳,5,2021.07.12.
17,GJ000018,STORE_GJ00002,광고예담밥상,uq2oas,게장 맛있네요 가족끼리 오기 좋아요 :),5,2021.07.12.
18,GJ000019,STORE_GJ00002,광고예담밥상,upkfja,"놀면뭐하니 나왔다 해서 가봤는데, ㄱㅊㄱㅊ 가족들이랑 같이 갈만해용",5,2021.07.05.
19,GJ000020,STORE_GJ00002,광고예담밥상,n24doa,잘 먹고 가요~ 반찬도 항상 정갈하고 맛이야 뭐 항상 좋네요,5,2021.07.05.
20,GJ000021,STORE_GJ00002,광고예담밥상,11et3ji,너무 맛있게 잘먹고 갑니다 ^^,5,2021.07.05.
21,GJ000022,STORE_GJ00002,광고예담밥상,12mgdoi,맛은 있는데 서비스 진짜 최악. 그렇게 음식을 던지고 쿵쿵 놓고 국자 달라니까 그냥 먹으라고 하고 얼굴 뜨거워져서 나원참,1,2021.07.01.
22,GJ000023,STORE_GJ00002,광고예담밥상,11aomrt,"예전에 기본정식 먹어보고 생각나서 가보았는데 최악이네요~ 별하나를 클릭해야지 리뷰를 쓸 수 있어서 쓰지만 몇천원하는 식사도 아닌데 손님을 뜨내기로 생각하고 다시는 안볼것처럼 사장님이 장사를 하시네요~ 오늘 갈비살2인과 간장게장2인을 시켰는데 간장게장이 주매뉴라고 2인,갈비살 2인을 총4인 주문했는데 게는 괜찮은데 간장은 신선하지가 않고 갈비살은 버터를 너무...",1,2021.06.10.
23,GJ000024,STORE_GJ00002,광고예담밥상,agcg0u,NaN,1,2021.05.31.
24,GJ000025,STORE_GJ00002,광고예담밥상,17uua5j,가성비 최악이네요,1,2021.03.31.
25,GJ000026,STORE_GJ00002,광고예담밥상,12kvdnc,부모님 모시고 갔다왔는데 잘먹고 갑니다 오래된 가게인데 이제 가보네요 ㅎㅎㅎ,5,2020.12.10.
26,GJ000027,STORE_GJ00002,광고예담밥상,vn2ptt,가족끼리 밥먹으려고 찾은 인생간장게장!! 찬들도 너무 맛있고 사장님이 너무 착하세요 굿굿 기분이 좋아지네요 !!! : ),5,2020.12.08.
27,GJ000028,STORE_GJ00002,광고예담밥상,NaN,정식이 가성비좋고 밑반찬도 정갈하게 잘 나와요~!!,1,2020.11.25.
28,GJ000029,STORE_GJ00002,광고예담밥상,1caq32r,It' s a nice place to get a full meal if you are hungry and looking for nothing more. The place is very bright during the day and has a nice indoor atmosphere.,4,2020.11.14.
29,GJ000030,STORE_GJ00002,광고예담밥상,qhfqns,"간장게장 정식 1인 ,양념갈빗살 정식 1인 따로 주문도 된다하시더라구요 저희는 예담특선을 시켰어요 맛있게 잘먹었습니다.",5,2020.10.14.
30,GJ000031,STORE_GJ00002,광고예담밥상,qgrng5,"간장게장 맛은 좋다. 누구나 좋아할 맛이다.  그러나 일본인 상대를 많이 하다 코로나때문에 피해를 받았는지는 모르겠으나, 간장게장의 맛을 제외하고 모든 것이 창렬화 되어 있다. 꽃게는 가장 작은 단위인 6미 짜리를 사용하고 있는 것 같고, 같이 주문한 소갈비구이 25,000원 짜리는 마치 서비스로 나오는 것과 같은 모양새다.  나머지 기본 반찬들도 어떻게 ...",2,2020.10.09.
31,GJ000032,STORE_GJ00002,광고예담밥상,90c4rf,반찬이 너무 짬. 3.5가격에 비해 부실한 게장. (꽃게 한마리) 반찬도 부실함. 종업원은 예의 없음. 예전에 비해 맛이 변했음.,1,2020.09.19.
32,GJ000033,STORE_GJ00002,광고예담밥상,v71p7q,"맛좋게 가족이랑 잘먹고가요, 저희끼리 앉을 수 있는 곳도 있어서 안전하게 먹고 왔어요",5,2020.08.26.
33,GJ000034,STORE_GJ00002,광고예담밥상,1a2c16k,간장게장 최고. 느끼하지 않고 신선하고 개운한 맛이 좋네요.,5,2020.07.21.
34,GJ000035,STORE_GJ00002,광고예담밥상,flo79i,가지 마세요.  포장해서 가지고 와서 집에 먹었다 설사 했습니다. 사장 응대도 꽝입니다.  가격대비 비싸구요.,1,2019.12.24.
35,GJ000036,STORE_GJ00002,광고예담밥상,1352lkd,"단체모임으로 갔습니다. 돌솥에 누룽지 만들어 먹을수있게 따뜻한 물도 제대로 주지도 않았구요. 반찬으로 나오는 손바닥만한 감자전 추가해달라하니 원래는 주문받는건데 그냥 서비스로 한접시 준다하네요.. 가격대비 푸짐하지도,맛있지도,친절하지도 않았어요 그리고 거기 사장으로 있던 주인 아줌마 굉장히 불친절하더라구요. 언제나가나 계속 빤히 쳐다보고있고 상당히 불쾌하더...",1,2019.09.30.
36,GJ000037,STORE_GJ00002,광고예담밥상,vvlaun,그닥 재방문안할거에요,1,2019.05.06.
37,GJ000038,STORE_GJ00002,광고예담밥상,v2h5i2,주인 인성터짐 개터짐 저 인성으로 장사 어떻게 할라는지 안타까웅,1,2019.03.13.
38,GJ000039,STORE_GJ00003,광고크래버 대게나라 광장점,1mfcunj,대게코스 고급스러움이 물씬~대게살도 많고 좋았습니다,4,2021.07.30.
39,GJ000040,STORE_GJ00003,광고크래버 대게나라 광장점,146m6e3,"맛나죠,,, 근디 비쌍",1,2021.07.25.
40,GJ000041,STORE_GJ00003,광고크래버 대게나라 광장점,1ll333v,음식 대체적으로 만족했습니다,3,2021.07.09.
41,GJ000042,STORE_GJ00003,광고크래버 대게나라 광장점,170oqqh,형편이 어려운 관계로 조심스럽게 상황을 얘기하고 예약을 하고 찾아간 이곳은 정말 한분한분 친절하고 좋은분들이며 음식 하나하나 맛있고 훌륭했습니다 질문하나도 잘 응대해주셨습니다 어젠 정말이지 행복한 시간이었습니다 정말 감사히 잘 먹었습니다~~^^,5,2021.06.24.
42,GJ000043,STORE_GJ00003,광고크래버 대게나라 광장점,1kmf7vi,어휴 대게살이 통통해가지궁 맛있었습니당,4,2021.06.15.
43,GJ000044,STORE_GJ00003,광고크래버 대게나라 광장점,1k6tjrq,정말 맛있어요 강추!!,4,2021.06.01.
44,GJ000045,STORE_GJ00003,광고크래버 대게나라 광장점,1jo3s71,"바로 쪄서 나와 그런 지, 따뜻따뜻 살이 많아서 맛있게 먹었네요",4,2021.05.18.
45,GJ000046,STORE_GJ00003,광고크래버 대게나라 광장점,10lrf5e,돈 많으면 가셔도 됩니다.  방문 전에 드실 킹크랩의 키로수 있는지 철저하게 확인하고 가시는게 좋을겁니다.  주문 전에도 확실히 확인하고 주문하시는게 좋을 겁니다.   그렇지 않으면..... 돈이 많이 들겁니다.,1,2021.05.10.
46,GJ000047,STORE_GJ00003,광고크래버 대게나라 광장점,e7em34,대게나라 평점조작 사람들 프로필 보면 바로 암,1,2021.05.08.
47,GJ000048,STORE_GJ00003,광고크래버 대게나라 광장점,1j7qrdb,"손질도 잘되어있고, 살수율도 좋아서 알차게 먹었습니다~ 게살 완전 부드러움!",5,2021.05.03.
48,GJ000049,STORE_GJ00003,광고크래버 대게나라 광장점,1ip0t3f,게에 살이 많았습니다. 비도 오고 날씨가 그랬는데. 맛있게 먹공 기분 풀렸어용 다른 것도 다양하게 잘 나왔습니당,4,2021.04.20.
49,GJ000050,STORE_GJ00003,광고크래버 대게나라 광장점,n07nu3,재건축 때문에 이전 준비 중이래요ㅠ저처럼 헛걸음들 하실까봐 적습니다 ㅠㅜ,1,2021.04.01.
50,GJ000051,STORE_GJ00003,광고크래버 대게나라 광장점,1hr76f4,아래에 맛집꾸릉이 보아라 세상무서운줄 모르고 꼴깝 떠는거 같아보여서 걱정되서 남깁니다 나도 여기 가본 사람은 아닙니다만 검색하다가 우연찮게 보게 됐는데 요즘 그렇게 악의적으로 댓글 남기면 처벌 받는다는거 뉴스 안보셨수??? 당신이 원하는게 그렇게 남겨서 사람들이 안가도록 만들어서 식당들 장사 안되게 하는게 목적이냐? 가게들 망하게 하는게 당신 목적이냐? 식...,3,2021.03.24.
51,GJ000052,STORE_GJ00003,광고크래버 대게나라 광장점,vr7871,"※광고(댓글알바)의심※  • 본 댓글은 해당 식당을 방문하진 않았으나, 동일 날짜에 여러명의 댓글알바가 의심되어 참고용으로 남깁니다.",1,2021.03.24.
52,GJ000053,STORE_GJ00003,광고크래버 대게나라 광장점,15h6grk,맛있는 잘 먹고 왔습니다~,4,2021.03.21.
53,GJ000054,STORE_GJ00003,광고크래버 대게나라 광장점,1gtaetn,킹크랩도 비린내 안나구 전반적으로 다 맛있고 깔끔했어요~,4,2021.02.25.
54,GJ000055,STORE_GJ00003,광고크래버 대게나라 광장점,15ascde,"직원분들 친절하고 위치 괜찮음 곁들이찬(쓰키다시)은 평범, 대게도 좋음 근데 가격이 많이 비쌈(다른곳에 1.5배 수준)",3,2021.02.23.
55,GJ000056,STORE_GJ00003,광고크래버 대게나라 광장점,1gb0e5s,직원분의 친절 서비스가 정말 좋았음 대게 살 통통하게 잘 나옵니당,4,2021.02.08.
56,GJ000057,STORE_GJ00003,광고크래버 대게나라 광장점,1fpsd2n,대게코스 점심 정식 깔끔하고 괜츈합니다,5,2021.01.22.
57,GJ000058,STORE_GJ00003,광고크래버 대게나라 광장점,1fht7uk,"직원분 친절,킹크랩 대박 잘 나왔어요",4,2021.01.14.
58,GJ000059,STORE_GJ00003,광고크래버 대게나라 광장점,1f847eh,"연휴에 포장 해 와서 먹었는데, 가격도 좋고, 집에서 먹기도 참 편합니다!",3,2021.01.05.
59,GJ000060,STORE_GJ00003,광고크래버 대게나라 광장점,1f1nrn0,점심 런치 정식 가격도 좋고 고급스럽네요,5,2020.12.30.
60,GJ000061,STORE_GJ00003,광고크래버 대게나라 광장점,1ergj6v,대게 살이 보들 보들!남친과 미리 크리스마스 분위기 냈네용,4,2020.12.24.
61,GJ000062,STORE_GJ00003,광고크래버 대게나라 광장점,1ek2h0o,점심시간 이용 회식~정식 주문해서 먹었는데 고급집니다 맛도 분위기도~,5,2020.12.16.
62,GJ000063,STORE_GJ00003,광고크래버 대게나라 광장점,1ec5k50,"포장 된다길래 포장 주문하고 찾으러 갔는데, 친절하게 응대 해 주셔서 기분 좋았고, 대게 엄청 포장 잘 되어 있었습니다.",4,2020.12.09.
63,GJ000064,STORE_GJ00003,광고크래버 대게나라 광장점,1e7h8gi,남친이랑 모처럼 맛있는 것 먹으면서 기분전환하고 킹크랩 짱 맛이고 또 가고 싶네요~,5,2020.12.04.
64,GJ000065,STORE_GJ00003,광고크래버 대게나라 광장점,1e4fohi,"킹크랩 살도 많고, 코스마다 나오는 요리가 정말 괜찮았어요",4,2020.12.01.
65,GJ000066,STORE_GJ00003,광고크래버 대게나라 광장점,o7hnco,비싸요,1,2020.11.28.
66,GJ000067,STORE_GJ00003,광고크래버 대게나라 광장점,1e06436,"여기 분위기가 조용하고 좋네요. 기분 좋은 식사 했습니당, 대게코스 먹을만해용",3,2020.11.26.
67,GJ000068,STORE_GJ00003,광고크래버 대게나라 광장점,1ddeorl,모임장소로 딱이네용 굳,5,2020.11.06.
68,GJ000069,STORE_GJ00003,광고크래버 대게나라 광장점,1ctqoae,"대게 반, 킹크랩 반 주문 후, 하나 하나 차려져 나와 기분좋게 먹었습니다. 살이 꽉 차 있어 좋네요",4,2020.10.19.
69,GJ000070,STORE_GJ00003,광고크래버 대게나라 광장점,1ckmood,연휴에 다녀왔던 곳 다시 가고 싶어용.대게 먹으러~맛있어용,4,2020.10.08.
70,GJ000071,STORE_GJ00003,광고크래버 대게나라 광장점,1ccjvva,"포장으로, 이렇게 잘 먹어도 되나? 싶더라구요, 포장도 고급지고~ 가족끼리 맛있게 먹고, 왔습니당",4,2020.09.28.
71,GJ000072,STORE_GJ00003,광고크래버 대게나라 광장점,1c21c98,"친구와 코스로 챙겨 나오는 것, 맛있게 먹었습니다. 잘 나오네용",3,2020.09.15.
72,GJ000073,STORE_GJ00003,광고크래버 대게나라 광장점,1bthrc9,"포장할인한다고 해서 갔어요, 집에서 찌는 번거로움도 없고, 깔끔하고, 완전 좋네요",3,2020.09.10.
73,GJ000074,STORE_GJ00003,광고크래버 대게나라 광장점,1bo0b0t,대게코스 대게도 대게지만 사이드 요리가 다양하게 준비되어 좋네요,5,2020.09.03.
74,GJ000075,STORE_GJ00003,광고크래버 대게나라 광장점,1bhh0i5,"킹크랩코스 주문, 처음 나오는 죽부터 시작해서 하나 하나 잘 나옵니당",4,2020.08.27.
75,GJ000076,STORE_GJ00003,광고크래버 대게나라 광장점,1bd1c69,매장 내부가 고급스러웠습니다 그리고 직원분이 친절하셔서 더 맛있게 먹은 듯해요,3,2020.08.21.
76,GJ000077,STORE_GJ00003,광고크래버 대게나라 광장점,1ba43fn,"휴일이라 그런지 많은 분들이 있었는데 복잡하단 느낌 하나 안 받고, 편안하게 잘 먹고 왔어요, 사이즈도 크고 맛나용",4,2020.08.18.
77,GJ000078,STORE_GJ00003,광고크래버 대게나라 광장점,1b5ekon,대게 잘 나와요. 남친이 사준 덕분에 맛있게 먹음,5,2020.08.12.
78,GJ000079,STORE_GJ00003,광고크래버 대게나라 광장점,1auulqf,"매장 내 분위기가 예뻐서, 같이 간 울 어머니도 너무 좋아하셔서 다음에도 꼭 오지 싶습니다^^",4,2020.08.04.
79,GJ000080,STORE_GJ00003,광고크래버 대게나라 광장점,u5jrfl,NaN,1,2020.08.02.
80,GJ000081,STORE_GJ00003,광고크래버 대게나라 광장점,1apobkb,킹크랩 주문 살이 진짜 대박이었어요~맛있네요,5,2020.07.28.
81,GJ000082,STORE_GJ00003,광고크래버 대게나라 광장점,19vffm8,"쾌적하고, 깔끔한 매장 분위기 만족, 주문한 대게코스도 만족하니 잘 먹었습니당",3,2020.07.17.
82,GJ000083,STORE_GJ00003,광고크래버 대게나라 광장점,19mg741,"대게 맛있궁~ 캐쉬백 상품권도 받공, 벌써 부터 언제 쓸까 계획 잡는 중!!!",4,2020.07.06.
83,GJ000084,STORE_GJ00003,광고크래버 대게나라 광장점,19cp5pm,"데이트하기 딱 좋아요,분위기도 그렇고, 색다른 메뉴이기도 하공~",4,2020.06.24.
84,GJ000085,STORE_GJ00003,광고크래버 대게나라 광장점,196uj07,정부긴급재난지원금 사용~ 조용하고 편안하게 먹고 왔어요.직원분의 친절 덕분에~ 더 잘 먹은 듯...,5,2020.06.16.
85,GJ000086,STORE_GJ00003,광고크래버 대게나라 광장점,1949bh4,"대게 포장으로, 집들이 잘 했습니다,포장할인 받고, 음식 고민 없이, 식구들과 집들이~ 만족합니당",5,2020.06.12.
86,GJ000087,STORE_GJ00003,광고크래버 대게나라 광장점,1922nhv,너무 잘 나와  놀랬던 곳~대게 살~ 통통~ 부들 부들해용,4,2020.06.09.
87,GJ000088,STORE_GJ00003,광고크래버 대게나라 광장점,18v5mbh,"지인들과 조용히 먹을 곳을 찾았는데, 여기 대게나라가 딱 이네요! 대게요리 너무 잘 나왔어요,통통,먹을 맛이 나는 그런 곳이였습니다.",4,2020.06.05.
88,GJ000089,STORE_GJ00003,광고크래버 대게나라 광장점,18tmumn,"대게가 정말 잘 준비되어, 나왔어요, 손질도 잘 되어 있어 기분좋게 먹었습니다~!",4,2020.06.03.
89,GJ000090,STORE_GJ00003,광고크래버 대게나라 광장점,18s4iud,"코스로 주문, 다양한 요리 나오고, 대게요리는 또 얼마나 맛있었던지, 오랜만의 외식 만족해서, 별 5개 드립니다^^",5,2020.06.01.
90,GJ000091,STORE_GJ00003,광고크래버 대게나라 광장점,18q6d4p,"통통 대게, 포장해 와서 먹었는데, 아이들도 무척 좋아하네요. 할인도 받고, 재난지원금도 사용하고^^",5,2020.05.29.
91,GJ000092,STORE_GJ00003,광고크래버 대게나라 광장점,18of7qp,"무지 고급스러워요, 음식이 나올 때마다, 설명해 주시는 직원 분 때문에 정말 잘 먹고 왔습니다. 킹크랩 살이 보통이 아님, 추천합니다^^",4,2020.05.27.
92,GJ000093,STORE_GJ00003,광고크래버 대게나라 광장점,18mt3gq,"주말, 포장해 와서, 집에서 먹었어요, 안심하게 되는 마음도 있고, 할인도 하고 있어서, 좋네요. 맛있었어요, 포장, 추천해용",5,2020.05.25.
93,GJ000094,STORE_GJ00003,광고크래버 대게나라 광장점,10go4pb,안가봤는데 밑에 5점들 죄다 광고입니다 속지마세요,1,2020.05.23.
94,GJ000095,STORE_GJ00003,광고크래버 대게나라 광장점,18ilu93,기념일을 기념하기 위해 데이트장소로 간 곳~ 대게 엄청 잘 먹었습니다. 대게살이 통통하게 아주 맛있게 잘 먹었습니다. 덕분에 점수도 땄습니다^^,5,2020.05.19.
95,GJ000096,STORE_GJ00003,광고크래버 대게나라 광장점,18at850,"킹크랩요리를 준비했는데, 너무나도 다양하게 나와서, 기분좋게 먹었습니다. 서비스 너무 좋아요, 무엇보다 킹크랩살이 꽉차 있어서 좋았습니다^^",5,2020.05.08.
96,GJ000097,STORE_GJ00003,광고크래버 대게나라 광장점,183qg79,"오랜만에 가족들과 함께, 외식 했어요, 고급스럽고, 맛있어서 대 만족 했네요.",4,2020.04.29.
97,GJ000098,STORE_GJ00003,광고크래버 대게나라 광장점,17nvomk,"대게가 너무 맛있게 잘 쪄서 나왔어요, 손질도 잘 되어 있구용,정말 가볼 만한 곳입니다^^",5,2020.04.13.
98,GJ000099,STORE_GJ00003,광고크래버 대게나라 광장점,171ukqf,대게요리가 너무 실하게 잘 나와서 만족했어요 담백 그 자체네요,4,2020.03.16.
99,GJ000100,STORE_GJ00003,광고크래버 대게나라 광장점,16mo516,"여기,꿀맛, 내 인생맛집 리스트 중 하나입니다. 대게 먹으러 갈 땐 대게나라 고햬",4,2020.03.04.
100,GJ000101,STORE_GJ00003,광고크래버 대게나라 광장점,16h7n8l,"고급스런 분위기 덕분에, 기분좋게 먹었어요, 손질이 잘 되어 있어서, 쉽게 쉽게 먹었네요, 살 통통 굿굿",5,2020.02.27.
101,GJ000102,STORE_GJ00003,광고크래버 대게나라 광장점,1696mqv,"가격이 비싸다는 걸 알았지만, 이해 되었습니다^^ 대게랑 같이 나오는 요리가 정말 고급스럽게 잘 나오네용",5,2020.02.17.
102,GJ000103,STORE_GJ00003,광고크래버 대게나라 광장점,15d2u69,"새해를 맞아, 데이트 장소로 선택한 이 곳, 싱싱한 대게를 마음껏 먹고 올 수 있어서 좋았어요, 품질이 굿, 대게 살이…실했습니다.",5,2020.01.09.
103,GJ000104,STORE_GJ00003,광고크래버 대게나라 광장점,15avolb,"부모님을 모시고, 새해 첫 날, 해돋이 여행 대신 온 대게나라, 고급스러운 분위기 속에서, 맛있게 먹었습니다!!!",5,2020.01.06.
104,GJ000105,STORE_GJ00003,광고크래버 대게나라 광장점,136c7ud,"킹크랩하고, 랍스타를 주문했는데, 다양한 다른 요리들도 함께 나와서, 더 맛있게 먹은 기억만 남네요, 서비스 굿~!",5,2019.12.31.
105,GJ000106,STORE_GJ00003,광고크래버 대게나라 광장점,115gcgf,분위기도 좋았구 가족끼리 맛있게 대게요리 먹고 왔어요|! 코스 음식 종류도 다양하구 괜찮네요^^,4,2019.12.26.
106,GJ000107,STORE_GJ00003,광고크래버 대게나라 광장점,qiiihc,밑에 댓글이 다 알바네요ㅡㅡ 글쓴사람 목록 들어가서  보면 죄다 대게나라  어디점 ㅋㅋㅋㅋㅋ 그냥 평범하게 먹고 온집입니다. 근데 댓글 장난해놔서  마음에 안드는 가게네요. ,1,2019.12.25.
107,GJ000108,STORE_GJ00003,광고크래버 대게나라 광장점,13vf0vm,"대게살이 부드러워서 맛있게 먹고 왔습니다. 손질도 잘 되어 나오고, 같이 나온 요리들도 다양해서,기분 좋게 먹었습니다.연말 모임에 와도 좋을 듯~!",5,2019.11.06.
108,GJ000109,STORE_GJ00003,광고크래버 대게나라 광장점,13o67sc,가족들과 외식하기 좋은거같아요^^ 맛있게 잘먹었습니다!,5,2019.10.28.
109,GJ000110,STORE_GJ00003,광고크래버 대게나라 광장점,123efn7,서비스가 불친절함. 이 돈이면 호텔 뷔페 가는게 나을 듯.,1,2019.08.11.
110,GJ000111,STORE_GJ00003,광고크래버 대게나라 광장점,v5amm6,"정말 맛있는 대게집 입니다^^ 코스로 다양하게 스키다시가 나오고, 메인요리는 또 얼마나 맛있는지!! 오랜만에 별 5개 드리고 갑니다!! 크래버대게나라 번창하세요~!!!!!!!!",5,2019.08.07.
111,GJ000112,STORE_GJ00003,광고크래버 대게나라 광장점,acajbn,비싸고 맛은 그럭저럭 돈으로 블로그광고하고 맛평점 올려 놓은듯 합니다,1,2018.07.03.
112,GJ000113,STORE_GJ00003,광고크래버 대게나라 광장점,9alubt,일단 가보지 않음 리뷰 보면 동일한 사진을 여러 블로거가 돌려가며 사용 즉 그냥 돈으로 평가 올려놓은거라 생각됨 그리고 가격문의 결과 비싸게 느껴짐,1,2018.05.03.
113,GJ000114,STORE_GJ00004,신토불이떡볶이 본점,n0pahf,"자극적이게 매운 맛, 맛없진 않은데 비쌈",3,2021.08.15.
114,GJ000115,STORE_GJ00004,신토불이떡볶이 본점,129vrqd,굿,5,2021.07.30.
115,GJ000116,STORE_GJ00004,신토불이떡볶이 본점,1dhgpdp,인생 떡볶이,5,2021.07.30.
116,GJ000117,STORE_GJ00004,신토불이떡볶이 본점,n08bmt,오뎅 국물 없고 단무지도 없고 만두는 튀긴지 아닌지 씹으면 물커엉 해서 식감이라고는 전혀 없고 떡만 씹다 영 허전해서 1인분도 먹다 남김,2,2021.07.20.
117,GJ000118,STORE_GJ00004,신토불이떡볶이 본점,7mkkuv,고딩때부터 자주가갔던곳인데 이사가서 몇년만에 갔더니 유명해지면서부터 맛이 변한거같아요.. 예전맛이 그립네요'',3,2021.07.19.
118,GJ000119,STORE_GJ00004,신토불이떡볶이 본점,13t0kuh,맛있고 맵고 생각보다 핫도그가 맛있었음!,5,2021.07.18.
119,GJ000120,STORE_GJ00004,신토불이떡볶이 본점,1f2ni0i,NaN,5,2021.07.16.
120,GJ000121,STORE_GJ00004,신토불이떡볶이 본점,e2njd6,인생떡볶이,5,2021.07.15.
121,GJ000122,STORE_GJ00004,신토불이떡볶이 본점,7nupd7,불친절,1,2021.07.11.
122,GJ000123,STORE_GJ00004,신토불이떡볶이 본점,bnf6ev,NaN,5,2021.06.26.
123,GJ000124,STORE_GJ00004,신토불이떡볶이 본점,1l3s3ud,별거 없는 것 같은데 계속 생각나요..가고 싶어요,5,2021.06.26.
124,GJ000125,STORE_GJ00004,신토불이떡볶이 본점,rve53u,일단 한지민 떡볶이로 너무 유명해서 갔고요. 떡볶이 맛집 찾아 삼만리였는데 맛보고 반가운 마음으로 맛있게 먹었습니다. 진짜 요즘 기본없는 분식집천진데 기본에 충실한 옛날 떡볶이 맛이었습니다. 떡도 쫄깃하고 간도 베었고 메뉴구성도 좋았습니다. 2인세트먹고 1인분 추가했네요. 일행도 모든것이 완벽했다고 극찬했습니다   따봉,5,2021.06.23.
