,review_code,place_code,ItemID,UserID,review,Rating,Timestamp
5882,GJ005883,STORE_GJ00242,해룡마라룽샤,bsu7gb,돈줘도 안갈라구요.,1,2018.06.21.
5883,GJ005884,STORE_GJ00242,해룡마라룽샤,mvjih1,너네 나라로 가라 원폭 맞기 싫으면,1,2018.06.21.
5884,GJ005885,STORE_GJ00242,해룡마라룽샤,f27bsc,taiwan no.1,1,2018.06.21.
5885,GJ005886,STORE_GJ00242,해룡마라룽샤,jsb3js,착짱죽짱,1,2018.06.21.
5886,GJ005887,STORE_GJ00242,해룡마라룽샤,gg9tlo,응 안먹어,1,2018.06.20.
5887,GJ005888,STORE_GJ00242,해룡마라룽샤,behq6t,"여기 조선족사장은 스웨덴전 축구졌다고 광화문에 핵쏴서 한국사람 다죽어야되고 한국사람 가게오지마라고 위챗올렸네 ㅋㅋㅋㅋㅋ ㅋㅋㅋㅋㅋ 이런소리듣고도가서 처먹으면 진짜 머리에 방사능맞은 한국사람임 ㅋㅋㅋㅋㅋ 그리고 조선족, 넌 중국으로 썩꺼져",1,2018.06.19.
5888,GJ005889,STORE_GJ00242,해룡마라룽샤,ckbqug,마라룽샤,3,2018.06.05.
5889,GJ005890,STORE_GJ00242,해룡마라룽샤,d3lk4f,평생 한번은 먹어볼만한 맛,3,2018.04.21.
5890,GJ005891,STORE_GJ00242,해룡마라룽샤,c5nn9n,소셜 미디어에서 유명한 맛집이라는데 내 입맛에는 글쎄.. 많이 시키는 세트가 마라룽샤+꿔바로우+볶음밥이다. 일단 꿔바로우는 너무 달다. 이 단맛이 입에 남아 다른 요리 맛들도 가려버림. 볶음밥은 쌀에 찰기가 없다. 마라룽샤는 비주얼은 좋아보이지만 뜯고나면 생각보다 먹을 게 너무 없다. 양념이 매콤달착지근한건 좋은데 이게 과해서 재료가 가지고 있는 고유의 바...,1,2018.02.11.
5891,GJ005892,STORE_GJ00243,강희자얼큰손만두국,kcslvg,만두속이 아주 꽉꽉 차여있어요,5,2021.07.26.
5892,GJ005893,STORE_GJ00243,강희자얼큰손만두국,18qio52,깔끔하고 담백한 맛  조금은 자극적이기도 함. 자리나 매장이 깔끔하게 정돈된 느낌은 아니지만 상당히 위생적임. 맛있음. 내입맛에는 너어어어무 맛있었음. ,5,2021.06.20.
5893,GJ005894,STORE_GJ00243,강희자얼큰손만두국,10b21p2,국물 넘 시원하고 시레기를 그냥은 못먹는데 이렇게 만두에 들어가 있으니까 먹게되네요. 그리고 다 친절하셔서 기분 좋게 먹고 나왔어요^^,5,2021.02.23.
5894,GJ005895,STORE_GJ00243,강희자얼큰손만두국,m49e20,"시래기만두국 처음으로 먹었는데 진짜 맛있어요. 만두속이 고기로 꽉찬것처럼 먹는내내 시래기 씹히는 맛이 예술이었어요! 만두알도 터질것 같이 양도 많고, 먹는내내 즐거웠어요~ 또 갈께요^^ ",5,2021.02.08.
5895,GJ005896,STORE_GJ00243,강희자얼큰손만두국,103h4h6,오늘은 줄 안서도 되네요;; 국물은 멸치와 채소 넣고 끓인듯 시원하구요~ 매운 만두는 매콤해서 전 개인적으로 그냥 만두가 좋아요. (참고로 들깨가루 조금 더 넣었으면 좋겠어요)  밥과 떡 리필 가능하고 6천원이면 땡큐 입니다^^1,4,2021.02.04.
5896,GJ005897,STORE_GJ00243,강희자얼큰손만두국,1cd8d1m,맛 별루;;;,1,2020.12.12.
5897,GJ005898,STORE_GJ00243,강희자얼큰손만두국,dtoro7,"1시 반쯤 갔을때, 몇개 안 남아서 어쩔 수 없이 매운 맛을 포장해서 왔는데요. 매운 것을 잘 못먹어서 눈물을 흘리며 먹었지만 얼큰하니 맛있네요!! 집근처에 있다면 종종 갈 것 같습니다!",5,2020.11.07.
5898,GJ005899,STORE_GJ00243,강희자얼큰손만두국,ul6tqe,시래기만두 존맛,5,2020.11.07.
5899,GJ005900,STORE_GJ00243,강희자얼큰손만두국,mucne3,service is good.  taste is awesome. ,5,2020.11.01.
5900,GJ005901,STORE_GJ00243,강희자얼큰손만두국,cl3u82,NaN,5,2020.10.07.
5901,GJ005902,STORE_GJ00244,도단집,16fm5ir,이딴 고기를 주길래 바꿔달랬더니 잘라서 안된다고 안바꿔줬습니다.  비계를 비싼돈 주고 먹으러 갔네요.  기분좋게 먹으러갔는데 기분이 안좋아서 대충먹고 계산할때 사장님한테 한번더 말씀드리러 했습니다. 그랬더니 알바생이 손사레를 치면서 사장님보고 신경쓰지 말라하더군요 내평생 이딴 고깃집은 처음봤습니다 근처에 사는데 지나갈때마다 망했으면 좋겠다는 생각을 합니다....,1,2021.07.08.
5902,GJ005903,STORE_GJ00244,도단집,siodbh,고기를 다 구워주고 자리마다 칸막이 있어서 매우좋음,5,2021.02.15.
5903,GJ005904,STORE_GJ00244,도단집,17qualu,NaN,5,2020.08.24.
5904,GJ005905,STORE_GJ00244,도단집,17hr1ro,"리뷰보고 걱정했는데 다들 짱친절에 맛도 여전했어요~ 특히 계란찜,볶음밥 인생 존맛탱구리였습니다~ 볶음밥에 계란후라이추가는 무조건 인당으로!♡",5,2020.07.15.
5905,GJ005906,STORE_GJ00244,도단집,mugpm2,직원 모두가 불친절해요. 손님을 가르치고 명령하는 투에요.,1,2020.04.03.
5906,GJ005907,STORE_GJ00244,도단집,16buj2r,맛있었는데 가격 넘 비쌌당 ,4,2020.02.21.
5907,GJ005908,STORE_GJ00244,도단집,qru5r1,냉삼  끝판왕,5,2018.08.17.
5908,GJ005909,STORE_GJ00245,방이샤브샤브칼국수 건대점,1b4c0id,나갈수없어서 먹었습니다.. ,1,2021.07.04.
5909,GJ005910,STORE_GJ00245,방이샤브샤브칼국수 건대점,1hat4k4,건대살때 해장하러 자주왔는데 오랜만에 먹어도 해장용으로 굿이네요,5,2021.05.08.
5910,GJ005911,STORE_GJ00245,방이샤브샤브칼국수 건대점,1c28897,요약 등촌칼국수생각하고 가면 진짜 별로 블로그에 양많고 후기좋던데 장난하나 ㅌㅌ  1-양이 진짜 이인은 모를까 삼인은 미친듯이 적어요 2-고기집게 꼭 확인하세요 더러운거 두번이나      묻어있었음 3- 그릇도 깨져있어요 진짜 짜증나요 옛날컨셉 그런데도 아닌데 4- 야채 추가할빠에 핫도그 사드세요 요즘 미나리도 싼데 2천원 추가에 미나리 100원크기보다 작...,1,2021.04.26.
5911,GJ005912,STORE_GJ00245,방이샤브샤브칼국수 건대점,1bk6fjs,버섯칼국수 생각날때마다 가용 넘 맛있어요~~~!!!,5,2021.03.25.
5912,GJ005913,STORE_GJ00245,방이샤브샤브칼국수 건대점,v2hsdk,별 1개도 아깝습니다. 주방에서 일하시는분이 마스크는 커녕 머리 두건도 안하고계시네요. 서빙하는 여성분. 중국인인지 베트남사람인지는 몰라도 정말 불친절하게 대하네요. 꼭 인원수대로 시켜야하나요? 위생이며 친절이며 마음에안듭니다.  다시는 안갑니다!,1,2020.11.10.
5913,GJ005914,STORE_GJ00245,방이샤브샤브칼국수 건대점,16v4uos,비위생적 매우,1,2020.10.13.
5914,GJ005915,STORE_GJ00245,방이샤브샤브칼국수 건대점,mu25g9,세트메뉴 가성비 굿 완전 얼큰  죽이 진짜 맛있음 ㅠㅠ 채고,4,2020.09.03.
5915,GJ005916,STORE_GJ00245,방이샤브샤브칼국수 건대점,195ov17,맛있어요~ 직원분들께서 뭐가 필요하다 하지 않아도 바로바로 도와주셔서 감사했습니다,5,2020.06.14.
5916,GJ005917,STORE_GJ00245,방이샤브샤브칼국수 건대점,cnc57d,양이 적을것 같아 걱정했는데 은근히 배부르네요. 얼큰한 육수이니 참고하시구요. 맛은 좋습니다ㅎㅎ,5,2019.12.17.
5917,GJ005918,STORE_GJ00245,방이샤브샤브칼국수 건대점,nn9p7s,맛있고 배불러 기분 좋은집 ㅋ,4,2018.10.04.
5918,GJ005919,STORE_GJ00245,방이샤브샤브칼국수 건대점,lcrqof,세트메뉴로 푸짐하게 맛있게 먹었어요~ ,4,2018.02.08.
5919,GJ005920,STORE_GJ00246,장인석닭한마리,njatle,여기만의 맛이 있음. 샤브샤브같은 국물에 한약재 향 살짝. 고기가 부드럽고 잡내없이 맛있음. 배추물김치가 맛있다.,4,2021.07.27.
5920,GJ005921,STORE_GJ00246,장인석닭한마리,nf018e,아직 여기까지 맛있는 닭한마리 찾기어려눠ㅠㅠ,5,2021.05.23.
5921,GJ005922,STORE_GJ00246,장인석닭한마리,15bu5cq,"모든 것이 『진짜』인 곳..  본인 제외 ""아 나 별로 배 안고픈데~"" 라고 말하는 3인 대동 시 닭한마리(4인)+칼국수 2+죽 2 남김없이 해치워버리는 곳  만약 배고픈 상태로 갔더라면 대체 몇인분을 먹었을지 무서워짐  비건 전 국무부장관이 와서 먹는다면 그의 일생 원탑 닭한마리로 꼽을 수 있을만한 곳  +) 불친절하다는 후기는 어째서인지? tmi 남발하...",5,2021.05.05.
5922,GJ005923,STORE_GJ00246,장인석닭한마리,qpbsuu,너무 맛잇는 곳이라 자주 가는 곳인데  아주 한가한 시간에 가면 안에 이모님들이 큰소리로 수다떠시고 사실 이건 전혀 상관없으나  트름을 정말 크게하셔서..밥맛이 좀 떨어졋어요..그 부분만 개선된다면 좋을 것 같습니다..,5,2021.01.21.
5923,GJ005924,STORE_GJ00246,장인석닭한마리,qu57u2,NaN,4,2020.11.17.
5924,GJ005925,STORE_GJ00246,장인석닭한마리,165dq0c,찐맛집 친절은 그냥 포기하고 가세요,4,2020.08.10.
5925,GJ005926,STORE_GJ00246,장인석닭한마리,bjpgo8,좋아요. 어머님들 친절하셨고 마스크 쓰심. ,4,2020.07.04.
5926,GJ005927,STORE_GJ00246,장인석닭한마리,10ua233,5번 정도 갔는데 여기가 맛은 괜찮은데 너무 불친절 함....그 앞에 생긴지 얼마 안 된 곳은 맛도 있고 친절한 편..밑에 평점 낮아서  놀랐다는 분 보고 내가 놀람...,1,2020.06.02.
5927,GJ005928,STORE_GJ00246,장인석닭한마리,18q4mup,여기서 닭한마리 먹은 이후로 다른 곳은 먹을 수 없다...,5,2020.05.29.
5928,GJ005929,STORE_GJ00246,장인석닭한마리,7kgsun,맛은 있는데 이 시국에 마스크 안 쓰고 일하신다. 사장님 종업원 다들 안 쓰신다,3,2020.04.25.
5929,GJ005930,STORE_GJ00246,장인석닭한마리,l6nr15,평일 저녁 여덟시 반에 가서 소주랑 먹다 아홉시 반쯤 손님이 저희밖에 없길래 남자 사장님에게 몇시 마감이냐 물어보니 열한시 마감이라고 손님들만 가면 일찍 퇴근할수 있다고 하길래 부랴부랴 일어났네요... 참고로 오픈은 아침 열시로 적혀있는데 실제 식사 가능한 시간은 열한시부터니까 일찍가서 피해보는일 없으시길 바랍니다... ,1,2020.01.18.
5930,GJ005931,STORE_GJ00246,장인석닭한마리,mufh26,여기서만먹어요,5,2019.12.07.
5931,GJ005932,STORE_GJ00246,장인석닭한마리,eca2k3,평점이 낮아서 놀랬네요@@사장님 친절하시고 이모님들도 친절하십니다~맛 정말 깔끔하고 닭도 신선하고 보양 제대로 할수있습니다~여긴 동네맛집이라 아는사람들만 가는곳입니다!^^ ,5,2019.11.29.
5932,GJ005933,STORE_GJ00246,장인석닭한마리,r1lh29,사장님 친절하시고 가격도 괜찮고 맛도 있어요!,4,2018.10.17.
5933,GJ005934,STORE_GJ00246,장인석닭한마리,lfhj1r,오랜만에 가보니 역시 맛있어요 ,5,2018.02.12.
5934,GJ005935,STORE_GJ00246,장인석닭한마리,h5l8le,불친절,1,2017.12.01.
5935,GJ005936,STORE_GJ00247,이대팔 건대점,fkv0pg,인생냉면 물냉면,5,2021.07.21.
5936,GJ005937,STORE_GJ00247,이대팔 건대점,g31ovh,맛있었는데 맛이 달라짐..,2,2021.03.06.
5937,GJ005938,STORE_GJ00247,이대팔 건대점,l6nr15,2020/10/16 기준 맛이 예전같지 않다,1,2020.10.18.
5938,GJ005939,STORE_GJ00247,이대팔 건대점,r66heo,만두는 밀가루맛 많이나고 만두 6천원인데ㅋㅋㅋ작은 찐만두 8개 들어있는거 보고 기함함... 그리고 냉면은 양념은 그럭저럭인데 식감이 딱 플라스틱 식감... 후... 돈쓰고 화나기...,1,2020.08.24.
5939,GJ005940,STORE_GJ00247,이대팔 건대점,19mhjrt,순대국도 냉면도 그냥 평타,2,2020.08.02.
5940,GJ005941,STORE_GJ00247,이대팔 건대점,t9r4ue,오지마세요,5,2020.06.28.
5941,GJ005942,STORE_GJ00247,이대팔 건대점,efv4fd,"오! 맛있네요!!! 비빔육회냉면이랑 물냉면, 접시고기먹었는데 완전 맛났어요!! ^^ 추천!",5,2019.05.19.
5942,GJ005943,STORE_GJ00247,이대팔 건대점,n1hrnu,물냉비냉 다 괜찮아요,4,2019.05.01.
5943,GJ005944,STORE_GJ00248,삼일민물장어,146m6e3,통통하고 맛난는데요. 그떄만 그랬나,5,2021.07.25.
5944,GJ005945,STORE_GJ00248,삼일민물장어,12kbspq,"3년전에 한번오고 괜찮았던 기억에 오랜만에 다시왔는데 그램수를 의심케하는 장어의크기와 직원의 불친절, 반찬부실함, 위생상태 등.. 너무 많은것이 변했다는 생각에 다시는 올일 없을것 같습니다",1,2021.06.06.
5945,GJ005946,STORE_GJ00248,삼일민물장어,lkscou,장어가 실하고 좋네요,5,2020.06.10.
5946,GJ005947,STORE_GJ00248,삼일민물장어,e7a9a0,"장어는 두툼하고 맛있지만.. 가격대비 서비스, 밑반찬 다 별로임. ",2,2019.11.17.
5947,GJ005948,STORE_GJ00248,삼일민물장어,g0kf83,여기 정말 맛있어요. 근처 사는데 양가부모님 모시고도 많이 갔답니다. 만족스러워요.,4,2019.07.06.
5948,GJ005949,STORE_GJ00249,버거킹 구의점,v86nsd,광장점에서 바뀌고 더 편하고 좋은 위치에 깔끔해졌어요,4,2021.05.20.
5949,GJ005950,STORE_GJ00249,버거킹 구의점,7kepli,NaN,5,2021.02.26.
5950,GJ005951,STORE_GJ00249,버거킹 구의점,u32i7a,굿,5,2020.12.10.
5951,GJ005952,STORE_GJ00249,버거킹 구의점,mvjr8a,자리 바뀌고나서 갔는데 남자직원분 불친절 역대급... 주문 바꾸는데 기분 나빠하면서 카드꽂고 아무말도 없이 가버림. 취소됐다 한마디 해주기가 힘든가? 난 취소가 된건지 뭔지도 모르고 카운터 앞에서 계속 기다리는데 보고도 끝까지 안내 안해주더라. 불러도 무시하공 ㅎㅎ 바쁜거 이해하는데 최소한의 안내만이라도 해주시길. 친절은 바라지도 않아요,1,2020.09.28.
5952,GJ005953,STORE_GJ00250,경성양고기꼬치구이,c113fr,점점 별로네...,2,2021.08.11.
5953,GJ005954,STORE_GJ00250,경성양고기꼬치구이,14n479n,가격대비 정말 최악. 마라양갈비 여섯꼬치 만육천받는집은 삼십년양꼬치먹으면서 첨 봄니다. 그렇다고 맛도 엄청 좋은것도 아니고.  ,1,2021.04.28.
5954,GJ005955,STORE_GJ00250,경성양고기꼬치구이,k12pru,"양꼬치, 꿔바로우, 온면 너무 맛있어요!",5,2021.03.28.
5955,GJ005956,STORE_GJ00250,경성양고기꼬치구이,11rcqda,NaN,4,2020.12.17.
5956,GJ005957,STORE_GJ00250,경성양고기꼬치구이,vm491b,찾아갈 정도는 아니던데?  어향가지는 다른 곳보다 맛있었음.  양갈비가 생각보다 별로... ,3,2020.10.03.
5957,GJ005958,STORE_GJ00250,경성양고기꼬치구이,brmbo1,"몇군데 다녀봤지만 난 여기가 젤 맛있음. 양꼬치, 지삼선, 온국수, 꿔바로우 먹어봤는데 다 중간 이상.",4,2020.07.23.
5958,GJ005959,STORE_GJ00250,경성양고기꼬치구이,kh7ris,양꼬치는 물론 다른 요리들도 맛좋음. 기본찬 구성도 훌륭함. 특히 옥수수국수 적극추천.,3,2020.07.19.
5959,GJ005960,STORE_GJ00250,경성양고기꼬치구이,th8sq9,굳이...? 찾아갈 필요는 없어보이는 고기질,3,2019.09.25.
5960,GJ005961,STORE_GJ00250,경성양고기꼬치구이,ejjiuf,"양꼬치 맛있고, 서비스로주는 마파두부가 맛있다.",4,2019.06.22.
5961,GJ005962,STORE_GJ00250,경성양고기꼬치구이,s84465,역시는 역시 양꼬치 처음 먹는 일행이나 중식=탕수육 고정관념 가진 분들께 양꼬치 입문으로 딱 좋은 동네 최고 유명식당,5,2019.04.24.
5962,GJ005963,STORE_GJ00250,경성양고기꼬치구이,bekaiu,NaN,3,2019.01.05.
5963,GJ005964,STORE_GJ00250,경성양고기꼬치구이,eomrsd,양꼬치 꿔바로우 마라탕 다 맛있다 데려간 지인 아무도 실망하지 않음 백프로 성공 맛집 음식 빠르게 나오고 항상 서비스로 주시는 마파두부 짱맛,5,2019.01.04.
5964,GJ005965,STORE_GJ00250,경성양고기꼬치구이,bg3ear,양꼬치 정말 맛있네요,5,2018.11.05.
5965,GJ005966,STORE_GJ00250,경성양고기꼬치구이,kr45gr,여긴 꿔바로우+양꼬치..!,4,2018.08.13.
5966,GJ005967,STORE_GJ00250,경성양고기꼬치구이,7vmgin,NaN,5,2018.07.21.
5967,GJ005968,STORE_GJ00250,경성양고기꼬치구이,luq4uo,여기가 지존맛 10년전에 양꼬치에 입문 시켜준곳  변함없이 신선한 양고기의 육즙,5,2018.03.20.
5968,GJ005969,STORE_GJ00250,경성양고기꼬치구이,119em5n,쏘쏘,3,2017.12.14.
5969,GJ005970,STORE_GJ00250,경성양고기꼬치구이,nas1d3,"고급양고기, 양꼬치~~~^^ 맛나요 양쪼우 차우퐌은 쫌 ㅋ",3,2017.02.26.
5970,GJ005971,STORE_GJ00250,경성양고기꼬치구이,94oil2,NaN,3,2016.12.12.
5971,GJ005972,STORE_GJ00250,경성양고기꼬치구이,100q04c,건대 매화반점보다 여기가 맛남ㅋㅋㅋ,5,2016.10.30.
5972,GJ005973,STORE_GJ00250,경성양고기꼬치구이,kae20d,뀌바로우  양꼬치,4,2016.06.04.
5973,GJ005974,STORE_GJ00250,경성양고기꼬치구이,106s6d8,"양꼬치 & 칭따오는 진리♡ 쯔란에 양꼬치를 딩굴딩굴 굴려서, 캬~ 새콤달콤 바싹한 꿔바로우도 함께! 아, 마늘 구워먹는것도 잊으면 안돼요~  약간의 웨이팅 정도는 감수하는걸로ㅋ",4,2016.04.16.
5974,GJ005975,STORE_GJ00251,재희네식당,ul6tqe,"2021년 별점수정 2개 2년 전에는 상가/동네사람이 많이가서 먹었는데 2020년부터 노가다 아저씨들 밥집 전용이 되어서 10시반에 가도 점심먹기 어려웠음. 4번 허탕치고 또 막상 밥을 먹더라도 노가다 아저씨들 왕창 몰려오니까 이모가 밥챙기느라 정신없어서 다른 주문은 자주 까먹음ㅜ 원래는 정겨운 노포 느낌 백반이었는데, 공간이 협소하다보니 밥먹다가 노가다 ...",2,2021.01.27.
5975,GJ005976,STORE_GJ00251,재희네식당,a9i229,"음식을 잘하는 집이네요 가격도 가격이지만 맛도 일품, 양도 일품 이었습니다 번창하세요",5,2020.12.10.
5976,GJ005977,STORE_GJ00251,재희네식당,13v1mdb,미친가성비 친절한 사장님과 이모들,4,2020.10.08.
5977,GJ005978,STORE_GJ00251,재희네식당,kgbo3p,ㅈㄴ 혜자,5,2019.10.26.
5978,GJ005979,STORE_GJ00252,D27,o9psss,가라아게 존맛 꼭드세여 친절하고 맛있음,5,2021.01.16.
5979,GJ005980,STORE_GJ00252,D27,cnc57d,지나갈때마다 만석이라 궁금해서 이른시간에 가봤는데 만석인 이유가 확실한 곳.,5,2020.06.20.
5980,GJ005981,STORE_GJ00252,D27,gfncmh,최애 맨날 가고싶다 ㅜ,5,2020.03.09.
5981,GJ005982,STORE_GJ00252,D27,slteiv,모든 메뉴가 맛있고 젊은 사장이 메뉴 연구를 많이 한 실력자라는걸 느끼게됨. 분위기는 덤? ,5,2020.01.31.
5982,GJ005983,STORE_GJ00252,D27,n0h9or,요즘 최애 술집. 가격/분위기/양 모두 만족합니다. 오늘의 메뉴 많이 개발해주세요 2-4명이 가기 좋은 곳 입니다 ,5,2019.01.30.
5983,GJ005984,STORE_GJ00253,스시메이진 건대점,17sqsqd,가성비 좋아요~,4,2021.06.08.
5984,GJ005985,STORE_GJ00253,스시메이진 건대점,1jqooo5,3접시 이상 못먹음. 디너 시작하고 갔는데 런치때 내놓은 회 그대로인지 반건조 초밥에다가 해산물 종류 모두 다 비림. 먹어는 보는지 모르겠음,1,2021.05.20.
5985,GJ005986,STORE_GJ00253,스시메이진 건대점,1jpsa23,맛있지만 음식들이 대체적으로 식었고 접시들이 금방금방 안 채워지더라구요ㅠㅠ,3,2021.05.19.
5986,GJ005987,STORE_GJ00253,스시메이진 건대점,1br8u68,음식이 대체로 너무 치가워요ㅠㅠ...,1,2021.05.06.
5987,GJ005988,STORE_GJ00253,스시메이진 건대점,rvnkq6,오잉!!!,5,2021.04.04.
5988,GJ005989,STORE_GJ00253,스시메이진 건대점,rono7h,그냥그래...... 아니 그냥 안그래.......,2,2021.02.10.
5989,GJ005990,STORE_GJ00253,스시메이진 건대점,eit0t3,와  내돈.............,1,2020.12.29.
5990,GJ005991,STORE_GJ00253,스시메이진 건대점,7kle75,별 1개도 아깝다 진심. 일요일 오후 2시에 갔는데 음식 90%가 말라있음. 가리비 채워달라니까 30분 기다리라네. 노량진에서 사옴? 디저트 슈 접시에 기름 고여있고 과일은 안닦아놔서 먹을 엄두가 안나더라. 토치질한 스시는 다 탐 ㅋㅋ 백화점 입점인데 왜 쿠우쿠우보다 못한거지? 그리고 알바생들이 바삐 움직이는데 마라샹궈는 1시간동안 텅텅 비어있음.. 대체 ...,1,2020.11.22.
5991,GJ005992,STORE_GJ00253,스시메이진 건대점,v6e6v8,"여기 초심 점점 잃어감. 올 봄까지는 좋았는데, 아래 리뷰처럼 점점 초밥을 안채우고 있음.",3,2020.08.17.
5992,GJ005993,STORE_GJ00253,스시메이진 건대점,mrk783,"스시 만드는 직원분(팔에 문신 있는 분) 일하기 싫으면 집으로 돌아가시길. 고객들 한명한명 그렇게 째려보시고 음식 만드는 것도 귀찮음과 대충대충이 딱 보이는게 밥맛 다 떨어지더군요, 그리고 그분 광어 초밥 담당이었는데 나오는 속도가 2G급임 살다살다 광어초밥 먹으려고 대기타는 스시부페는 처음이었습니다. (진짜 스시가 심각할 정도로 나오질 않아서 거의 사이드...",1,2020.07.26.
5993,GJ005994,STORE_GJ00253,스시메이진 건대점,bf8d66,아직 초심을 안 잃은 것 같아서 만족!,5,2020.06.21.
5994,GJ005995,STORE_GJ00254,미주류,qvfmk4,자리있냐해서 갔더니 있다고 해서 앉자서 메뉴 다시켰는데 예약되어있었다고 나가라고함 처음갔는데 서비스의 개실망 아무리 맛있다고 해도 첫느낌이 이러니 평생 안갈집,1,2021.05.16.
5995,GJ005996,STORE_GJ00254,미주류,7pern0,나만 알고 싶은 맛집..,5,2021.05.02.
5996,GJ005997,STORE_GJ00254,미주류,qin1n6,"인테리어 깔끔, 서비스 굿, 안주 보통, 술 다양",4,2021.03.16.
5997,GJ005998,STORE_GJ00254,미주류,14925ed,안주가 맛있고 이뻐요 인테리어도 깔끔!,5,2020.11.10.
5998,GJ005999,STORE_GJ00254,미주류,oaj2pu,NaN,5,2020.09.20.
5999,GJ006000,STORE_GJ00254,미주류,r3n3a3,화장실 칭소 제발 플리즈 똥물이 둥둥 ,1,2020.05.31.
6000,GJ006001,STORE_GJ00254,미주류,e4mumv,조용하고 분위기 좋네요! 음식도 맛있었어요.,4,2019.12.08.
6001,GJ006002,STORE_GJ00255,양촌리화로구이,1fcbhh1,별로 추천하고 싶지않은 식당임 종사하시는 분들은 나름 괜찮은 인상을 받음 그런데 주인장의 모친 인 것 같은데 손님을 막 대하는 느낌을 받음 에피소드 물 self (생수 비치) 약간 시간이 된 사건이죠 와이프와 애들은 간혹 가서 고기를 먹는것 같은데 간만에 저녘 나도 참석!! 물을 기다리다 와이프 왈 셀프! 란 말든고 생수통 갖으러 감 4명이라 3개 들고 가...,1,2021.06.06.
6002,GJ006003,STORE_GJ00255,양촌리화로구이,1as1mrc,존맛탱,5,2021.01.20.
6003,GJ006004,STORE_GJ00255,양촌리화로구이,14c550t,별로...........,1,2020.11.19.
6004,GJ006005,STORE_GJ00255,양촌리화로구이,17vsqlu,별하나도 아깝다. 돼지갈비에서 돼지 냄새 나고 동네에서 이리 장사해서 어쩔가 걱정됨~,1,2020.04.24.
6005,GJ006006,STORE_GJ00255,양촌리화로구이,f3tg6v,저번주 일요일 점심으로 갔어요. 양념갈비 4인분 시켰는데 고기는 다른집보다 두꺼워서 아 이래서 사람들 많이 오나보다 했어요. 하지만 문제는 서비스였어요. 김치찌개랑 공깃밥 시켰는데 한참을 기다려도 서비스인 된장찌개도 안나오고 김치찌개랑 공깃밥도  안 나오더라고요. 그래서 직원에기 얘기했더니 알았다고 했는데 그래도 안 나왔어요. 한참후에 우리한테 와서 하는 ...,2,2020.01.16.
6006,GJ006007,STORE_GJ00255,양촌리화로구이,13bh9sm,너무 길이 막혀서 들른 집인데 정말 최악의 갈비집. 연말 제대로 분위기 망쳤습니다. 그람수는 모르겠고 입으로 들어가는 양은... 체감하는 가격은 다른곳 세 배정도. 가격비싸고 양 적으니. 그리고 뭘 좀 요청하면 저 여기 알바인데요 하고 자리 피함. 음식 서비스 가격 뭐하나 ... 정말 그렇게 장사하심 안 되요.. ,1,2020.01.03.
6007,GJ006008,STORE_GJ00255,양촌리화로구이,s678ko,삼겹살기준 고기 그냥 보통 김치찌개 맛있음 나쁘진않음ㅇㅇ 주차공간 좋고 놀이방 갠차늠,3,2019.11.11.
6008,GJ006009,STORE_GJ00255,양촌리화로구이,7mf96e,와 진짜 쓰레기 고기집 8만이나되는소고기를 냉동고에서ㅠ 딱봐도 그람수도 확연히적어보이는데 800그람이라는 꽃등심 고기늘 수없이먹어본내가도저희이해가 안가 저울다시달아달라했는데 아 .~~~또생각하니 짱나네 가족들모신자리라  암말안했지만 님들은 제발이글보고 가지마시길  거기노랑머리,1,2019.09.29.
6009,GJ006010,STORE_GJ00255,양촌리화로구이,e9e4oh,사실 김치찌개 맛집이라는거.. 고기에서 2점 감점,3,2019.07.24.
6010,GJ006011,STORE_GJ00255,양촌리화로구이,ferjnp,NaN,5,2019.06.07.
6011,GJ006012,STORE_GJ00255,양촌리화로구이,tcjrc9,"가격에 비해 맛과 질 모두 별로인듯... 냉면 8,000원에 파는데 고기 한 점 안들어있음... ",1,2019.03.09.
6012,GJ006013,STORE_GJ00255,양촌리화로구이,e7lotn,평양냉면을 파는데 진짜 먹기 힘들정도로 맛이 없습니다. ,1,2018.06.06.
6013,GJ006014,STORE_GJ00255,양촌리화로구이,9cstfc,삼겹살고기가맛있었고 김치도깔끔하니 맛있었어요,5,2017.11.07.
6014,GJ006015,STORE_GJ00256,울돌목주먹고기,n83rnf,맛을 떠나서 서비스 정신이 결여된 집 돈내고 기분 잡치고 싶으면 가보시길,1,2021.06.07.
6015,GJ006016,STORE_GJ00256,울돌목주먹고기,lar37j,이거저거 다 떠나서 맛은 5점~,5,2021.04.09.
